{
  "manifestVersion": "0.1.0",
  "name": "form-analysis-kit-suite",
  "displayName": "Form Analysis Kit Suite",
  "sourceSystem": {
    "path": "C:\\Users\\gslab\\Desktop\\Form-analysis-server-specify-kit",
    "appRoot": "form-analysis-server",
    "frontendRoot": "form-analysis-server/frontend",
    "backendRoot": "form-analysis-server/backend"
  },
  "defaultDatabaseRecommendation": {
    "engine": "postgresql",
    "reason": "The target system uses tenant-scoped production records, async SQLAlchemy, Alembic, JSON/JSONB-style query paths, background import jobs, and analytics workflows. PostgreSQL is the safest production default."
  },
  "kits": [
    {
      "id": "platform-core-kit",
      "displayName": "平台核心",
      "category": "foundation",
      "required": true,
      "businessCapability": "提供應用程式啟動、設定、資料庫連線、健康檢查、共用樣式、語系與 API 呼叫基礎。",
      "dependencies": [],
      "frontend": {
        "pages": [],
        "components": [],
        "services": [
          "frontend/src/services/fetchWrapper.ts",
          "frontend/src/services/a11y.ts"
        ],
        "shellFiles": [
          "frontend/src/App.tsx",
          "frontend/src/main.tsx",
          "frontend/src/i18n.ts",
          "frontend/src/locales"
        ]
      },
      "backend": {
        "routers": [
          "backend/app/api/routes_health.py"
        ],
        "core": [
          "backend/app/main.py",
          "backend/app/core/config.py",
          "backend/app/core/database.py",
          "backend/app/core/logging.py",
          "backend/app/core/middleware.py",
          "backend/app/api/deps.py"
        ],
        "services": []
      },
      "database": {
        "models": [],
        "migrations": [
          "backend/alembic"
        ]
      },
      "preview": {
        "supportsRealtimePreview": true,
        "previewMode": "app-shell"
      },
      "subfeatures": [
        {
          "id": "app-shell",
          "displayName": "應用程式 shell",
          "businessCapability": "提供前端入口、共用版面、語系與樣式基礎。",
          "defaultSelected": true,
          "dependencies": [],
          "aliases": [
            "shell",
            "layout",
            "i18n"
          ]
        },
        {
          "id": "configuration-management",
          "displayName": "設定管理",
          "businessCapability": "集中管理環境設定與系統啟動設定。",
          "defaultSelected": true,
          "dependencies": [],
          "aliases": [
            "config",
            "env"
          ]
        },
        {
          "id": "database-connection",
          "displayName": "資料庫連線",
          "businessCapability": "提供後端資料庫連線、session 與 migration 基礎。",
          "defaultSelected": true,
          "dependencies": [],
          "aliases": [
            "database",
            "db"
          ]
        },
        {
          "id": "health-check",
          "displayName": "健康檢查",
          "businessCapability": "提供服務健康檢查 API 與維運探針。",
          "defaultSelected": true,
          "dependencies": [],
          "aliases": [
            "health",
            "status"
          ]
        },
        {
          "id": "api-client-foundation",
          "displayName": "API 呼叫基礎",
          "businessCapability": "提供前端 API wrapper、錯誤處理與可及性輔助。",
          "defaultSelected": true,
          "dependencies": [],
          "aliases": [
            "fetch",
            "api"
          ]
        }
      ]
    },
    {
      "id": "tenant-auth-kit",
      "displayName": "租戶與登入權限",
      "category": "security",
      "required": true,
      "businessCapability": "讓不同公司或部門隔離資料，並管理登入、API key、使用者角色與管理員權限。",
      "dependencies": [
        "platform-core-kit"
      ],
      "frontend": {
        "pages": [
          "frontend/src/pages/RegisterPage.tsx",
          "frontend/src/pages/AdminPage.tsx",
          "frontend/src/pages/ManagerPage.tsx"
        ],
        "components": [],
        "services": [
          "frontend/src/services/auth.ts",
          "frontend/src/services/adminAuth.ts",
          "frontend/src/services/tenant.ts",
          "frontend/src/services/tenantMap.ts"
        ]
      },
      "backend": {
        "routers": [
          "backend/app/api/routes_auth.py",
          "backend/app/api/routes_tenants.py"
        ],
        "core": [
          "backend/app/core/auth.py",
          "backend/app/core/bootstrap.py",
          "backend/app/core/password.py",
          "backend/app/core/tenant_resolver.py"
        ],
        "services": []
      },
      "api": [
        "GET /api/auth/whoami",
        "POST /api/auth/login",
        "POST /api/auth/me/password",
        "GET /api/auth/users",
        "POST /api/auth/admin/tenant-api-keys",
        "GET /api/tenants",
        "POST /api/tenants"
      ],
      "database": {
        "models": [
          "Tenant",
          "TenantUser",
          "TenantApiKey"
        ]
      },
      "permissions": [
        "admin",
        "manager",
        "tenant user"
      ],
      "preview": {
        "supportsRealtimePreview": true,
        "previewMode": "mock-auth-session"
      },
      "subfeatures": [
        {
          "id": "tenant-list-and-create",
          "displayName": "租戶列表與建立",
          "businessCapability": "建立與瀏覽租戶，作為資料隔離邊界。",
          "defaultSelected": true,
          "dependencies": [],
          "aliases": [
            "tenant",
            "租戶"
          ]
        },
        {
          "id": "user-login",
          "displayName": "使用者登入",
          "businessCapability": "提供使用者登入、身份確認與密碼更新。",
          "defaultSelected": true,
          "dependencies": [],
          "aliases": [
            "login",
            "auth",
            "登入"
          ]
        },
        {
          "id": "api-key-issue",
          "displayName": "API key 發行",
          "businessCapability": "為租戶或管理端發行 API key。",
          "defaultSelected": true,
          "dependencies": [],
          "aliases": [
            "api key",
            "token"
          ]
        },
        {
          "id": "user-management",
          "displayName": "使用者管理",
          "businessCapability": "管理使用者角色、狀態與權限。",
          "defaultSelected": true,
          "dependencies": [],
          "aliases": [
            "users",
            "roles"
          ]
        },
        {
          "id": "admin-unlock",
          "displayName": "管理員解鎖",
          "businessCapability": "提供管理員操作入口與解鎖流程。",
          "defaultSelected": true,
          "dependencies": [],
          "aliases": [
            "admin",
            "管理員"
          ]
        }
      ]
    },
    {
      "id": "station-data-link-kit",
      "displayName": "站點資料串聯",
      "category": "data-model",
      "required": true,
      "businessCapability": "保存並標準化多站點製程資料，將 P1/P2/P3 或未來新增站點依 lot、winder、product_id 串成可追溯資料鏈。",
      "dependencies": [
        "platform-core-kit",
        "tenant-auth-kit"
      ],
      "frontend": {
        "pages": [],
        "components": [],
        "services": []
      },
      "backend": {
        "routers": [],
        "models": [
          "backend/app/models/p1_record.py",
          "backend/app/models/p2_record.py",
          "backend/app/models/p3_record.py",
          "backend/app/models/p2_item_v2.py",
          "backend/app/models/p3_item_v2.py",
          "backend/app/models/generic_record.py",
          "backend/app/models/business/records.py"
        ],
        "services": [
          "backend/app/utils/normalization.py",
          "backend/app/services/product_id_generator.py",
          "backend/app/services/production_date_extractor.py"
        ]
      },
      "database": {
        "models": [
          "P1Record",
          "P2Record",
          "P2ItemV2",
          "P3Record",
          "P3ItemV2",
          "GenericRecord",
          "GenericRecordItem"
        ]
      },
      "preview": {
        "supportsRealtimePreview": true,
        "previewMode": "data-relationship-cards"
      },
      "subfeatures": [
        {
          "id": "station-data-model",
          "displayName": "站點資料模型",
          "businessCapability": "定義站點資料、明細列與跨站點關聯。",
          "defaultSelected": true,
          "dependencies": [],
          "aliases": [
            "station",
            "站點"
          ]
        },
        {
          "id": "p123-compatibility-adapter",
          "displayName": "P1/P2/P3 相容層",
          "businessCapability": "保留既有 P1/P2/P3 資料表與欄位相容。",
          "defaultSelected": true,
          "dependencies": [],
          "aliases": [
            "P1",
            "P2",
            "P3"
          ]
        },
        {
          "id": "new-station-definition",
          "displayName": "新站點資料定義",
          "businessCapability": "支援未來新增站點與泛用資料模型。",
          "defaultSelected": true,
          "dependencies": [],
          "aliases": [
            "generic station"
          ]
        },
        {
          "id": "lot-normalization",
          "displayName": "lot normalization",
          "businessCapability": "標準化 lot 與 winder 等追溯鍵。",
          "defaultSelected": true,
          "dependencies": [],
          "aliases": [
            "lot",
            "normalize"
          ]
        },
        {
          "id": "product-id-generation",
          "displayName": "product_id 產生",
          "businessCapability": "依規則產生或整理 product_id。",
          "defaultSelected": true,
          "dependencies": [],
          "aliases": [
            "product id"
          ]
        },
        {
          "id": "generic-record",
          "displayName": "generic record",
          "businessCapability": "提供泛用記錄與明細模型。",
          "defaultSelected": true,
          "dependencies": [],
          "aliases": [
            "generic record"
          ]
        }
      ]
    },
    {
      "id": "upload-validation-kit",
      "displayName": "檔案上傳與驗證",
      "category": "workflow",
      "required": false,
      "businessCapability": "使用者上傳 CSV、Excel 或 PDF，系統建立上傳工作、驗證內容、顯示錯誤並允許修正。",
      "dependencies": [
        "platform-core-kit",
        "tenant-auth-kit"
      ],